source_id,question,answer,difficulty,rationale
1,What was observed in the concentrations of serum proteins compared to matched control persons?,Significantly changed,medium,The passage states that 'the concentrations of... the serum proteins were significantly changed compared with matched control persons'.
1,Was there a correlation between the number of precipitins and the concentrations of acute phase proteins?,"Yes, notably haptoglobin was correlated",medium,The passage states that 'the concentrations of... the acute phase proteins notably haptoglobin were correlated to the number of precipitins'.
2,At what age do children's salivary amylase levels typically reach adult levels?,12 months to 1 year,easy,The passage states that 'concentrations rose from very low levels at birth to reach adult levels by the age of 12 months to 1 year'.
2,What is unusual about the salivary amylase concentrations in children with cystic fibrosis?,They are mostly normal,medium,The passage states that 'thirteen children with coeliac disease and children with cystic fibrosis mostly had normal salivary amylase concentrations'.
3,What age group showed precise discrimination between CF patients and controls?,Individuals above one year of age,medium,The passage states that 'the discrimination between cf patients and controls was found to be precise for individuals above one year of age'.
3,What is a limitation of using INAA of nail clippings in newborns?,It cannot detect heterozygotes,medium,The passage states that 'heterozygotes could not be detected by the method during the first five days of life'.
